{
  "diff_id": "d-6efc9d24",
  "verdict": "CANT_EVALUATE",
  "offense_delta_pct": 0,
  "defense_delta_pct": 0,
  "sentence": "Trigger setup makes the main skill ambiguous; open details and pick your skill to get a verdict.",
  "assumptions": [
    {
      "id": "main_skill.trigger_ambiguity",
      "label": "trigger build",
      "value": true,
      "impactful": true,
      "reversible": true,
      "source_rule": "main_skill.trigger_ambiguity"
    },
    {
      "id": "main_skill.most_linked_highest_dps",
      "label": "skill: Cremation",
      "value": "Cremation",
      "impactful": true,
      "reversible": true,
      "source_rule": "main_skill.most_linked_highest_dps"
    },
    {
      "id": "config.flasks_up",
      "label": "flasks up",
      "value": true,
      "impactful": false,
      "reversible": true
    }
  ],
  "confidence": 0.5,
  "cant_evaluate_reasons": [
    "main_skill.trigger_ambiguity: trigger setup reduces skill-detection confidence",
    "aggregate confidence 0.50 below cant_evaluate_below threshold 0.55"
  ],
  "preset": "mapping",
  "compute_ms": 121
}
