{
  "diff_id": "d-59d0b8e2",
  "verdict": "UPGRADE",
  "offense_delta_pct": 9.8,
  "defense_delta_pct": 0.2,
  "sentence": "More lightning damage and cast speed lift Arc DPS 9.8%; defences are effectively unchanged.",
  "assumptions": [
    {
      "id": "main_skill.most_linked_highest_dps",
      "label": "skill: Arc",
      "value": "Arc",
      "impactful": true,
      "reversible": true,
      "source_rule": "main_skill.most_linked_highest_dps"
    },
    {
      "id": "config.elemental_overload",
      "label": "crit recently",
      "value": true,
      "impactful": true,
      "reversible": true,
      "source_rule": "config.elemental_overload"
    },
    {
      "id": "config.shock_from_setup",
      "label": "enemy shocked",
      "value": true,
      "impactful": true,
      "reversible": true,
      "source_rule": "config.shock_from_setup"
    },
    {
      "id": "config.power_charges_from_generation",
      "label": "power charges",
      "value": true,
      "impactful": true,
      "reversible": true,
      "source_rule": "config.power_charges_from_generation"
    },
    {
      "id": "config.chill_from_setup",
      "label": "enemy chilled",
      "value": true,
      "impactful": false,
      "reversible": true,
      "source_rule": "config.chill_from_setup"
    },
    {
      "id": "config.flasks_up",
      "label": "flasks up",
      "value": true,
      "impactful": false,
      "reversible": true,
      "source_rule": "config.flasks_up"
    }
  ],
  "confidence": 0.7,
  "preset": "mapping",
  "compute_ms": 187
}
