{
  "diff_id": "d-3b9e77c0",
  "verdict": "SIDEGRADE",
  "offense_delta_pct": 0.6,
  "defense_delta_pct": -0.4,
  "sentence": "Near-identical single-target output; you trade a sliver of armour for attack speed.",
  "assumptions": [
    {
      "id": "main_skill.user_override",
      "label": "skill: Boneshatter (yours)",
      "value": "Boneshatter",
      "impactful": true,
      "reversible": true,
      "source_rule": "main_skill.user_override"
    },
    {
      "id": "config.flasks_up",
      "label": "flasks up",
      "value": true,
      "impactful": false,
      "reversible": true
    }
  ],
  "confidence": 0.9,
  "preset": "bossing",
  "compute_ms": 96
}
